{"schema_version":1,"profile":"core","workload":"core","warmup_samples":3,"measured_samples":15,"iterations_per_sample":1000,"toolchain":"Zig 0.16.0","machine":"AMD EPYC 9754; Windows Server 2025 Datacenter 10.0.26100 build 26100; 63 GiB RAM","latency_ns":{"mean":7972766,"p50":6684300,"p95":14763300,"min":6192100,"max":14763300},"throughput_ops_per_second":125426.974,"allocation_events":30000,"allocation_high_water_bytes":71,"cpu_time_ns":null,"binary_size_bytes":null,"cancellation_latency_ns":0,"shutdown_time_ns":0,"sample_latency_ns":[14644800,14763300,11540700,6401300,6766500,6192100,6380800,6324800,6208800,6900800,7003200,6684300,6466800,6571700,6741600]}
